{
  "$schema": "https://json-schema.org/draft/2020-12/schema",
  "$id": "https://github.com/MicroMilo/upstream-radar/blob/main/schemas/dsh-install-observation.schema.json",
  "title": "Upstream Radar DSH install observation",
  "description": "Bounded process, network and filesystem evidence from installing and loading one exact npm artifact under one exact DSH version in an externally supplied disposable environment.",
  "type": "object",
  "additionalProperties": false,
  "required": ["schema", "tool", "probe", "scope", "startedAt", "completedAt", "dshVersion", "runtime", "artifact", "stages", "observations", "filesystem", "resolution", "result", "reason", "boundary"],
  "properties": {
    "schema": { "const": "upstream-radar.dsh-install-observation/v1alpha1" },
    "tool": {
      "type": "object",
      "additionalProperties": false,
      "required": ["name", "version"],
      "properties": {
        "name": { "const": "upstream-radar" },
        "version": { "type": "string", "minLength": 1, "maxLength": 256 }
      }
    },
    "probe": { "const": "dsh-install" },
    "scope": { "const": "install-and-load-behavior" },
    "executionContract": { "const": "dsh-install/v1alpha6" },
    "profileEnvironment": {
      "type": "object", "additionalProperties": false,
      "required": ["pnpmVersion", "overrides"],
      "properties": {
        "pnpmVersion": { "type": "string", "pattern": "^[0-9]+\\.[0-9]+\\.[0-9]+(?:-[0-9A-Za-z.-]+)?$" },
        "overrides": {
          "type": "object", "maxProperties": 64,
          "propertyNames": { "type": "string", "maxLength": 214, "pattern": "^(?:@[A-Za-z0-9._~-]+/)?[A-Za-z0-9._~-]+$" },
          "additionalProperties": { "type": "string", "minLength": 1, "maxLength": 512 }
        }
      }
    },
    "startedAt": { "type": "string", "format": "date-time" },
    "completedAt": { "type": "string", "format": "date-time" },
    "caseId": { "type": "string", "pattern": "^[a-z0-9][a-z0-9._-]{0,63}$" },
    "dshVersion": { "type": "string", "pattern": "^[0-9]+\\.[0-9]+\\.[0-9]+(?:-[0-9A-Za-z.-]+)?$" },
    "runtime": {
      "type": "object",
      "additionalProperties": false,
      "required": ["platform", "architecture", "nodeVersion", "packageManager"],
      "properties": {
        "platform": { "type": "string", "minLength": 1, "maxLength": 64 },
        "architecture": { "type": "string", "minLength": 1, "maxLength": 64 },
        "nodeVersion": { "type": "string", "pattern": "^[0-9]+\\.[0-9]+\\.[0-9]+(?:-[0-9A-Za-z.-]+)?$" },
        "packageManager": {
          "type": "object",
          "additionalProperties": false,
          "required": ["name"],
          "properties": {
            "name": { "const": "pnpm" },
            "version": { "type": "string", "pattern": "^[0-9]+\\.[0-9]+\\.[0-9]+(?:-[0-9A-Za-z.-]+)?$" }
          }
        }
      }
    },
    "artifact": { "$ref": "#/$defs/artifact" },
    "stages": {
      "type": "object",
      "additionalProperties": false,
      "required": ["runtime", "artifact", "profile", "install", "registration", "load"],
      "properties": {
        "runtime": { "$ref": "#/$defs/stage" },
        "artifact": { "$ref": "#/$defs/stage" },
        "profile": { "$ref": "#/$defs/stage" },
        "install": { "$ref": "#/$defs/stage" },
        "registration": { "$ref": "#/$defs/stage" },
        "load": { "$ref": "#/$defs/stage" }
      }
    },
    "observations": {
      "type": "object",
      "additionalProperties": false,
      "required": ["install", "load"],
      "properties": {
        "install": { "$ref": "#/$defs/trace" },
        "load": { "$ref": "#/$defs/trace" }
      }
    },
    "filesystem": {
      "type": "object",
      "additionalProperties": false,
      "required": ["install", "load"],
      "properties": {
        "install": { "$ref": "#/$defs/filesystemDiff" },
        "load": { "$ref": "#/$defs/filesystemDiff" }
      }
    },
    "resolution": { "$ref": "#/$defs/resolution" },
    "result": { "enum": ["compatible", "runtime-incompatible", "peer-contract-incompatible", "build-approval-required", "install-failed", "load-failed", "unknown"] },
    "reason": { "type": "string", "maxLength": 4096 },
    "boundary": {
      "type": "object",
      "additionalProperties": false,
      "required": ["isolationProviderClaim", "isolationVerifiedByRadar", "disposableEnvironmentRequired", "lifecycleScriptsEnabledForPluginInstall", "pluginCodeMayExecuteDuringLoad", "inheritedHostSecrets", "approvedDependencyBuilds", "note"],
      "properties": {
        "isolationProviderClaim": { "enum": ["github-actions-hosted-runner", "firecracker", "other"] },
        "isolationVerifiedByRadar": { "const": false },
        "disposableEnvironmentRequired": { "const": true },
        "lifecycleScriptsEnabledForPluginInstall": { "const": true },
        "pluginCodeMayExecuteDuringLoad": { "const": true },
        "inheritedHostSecrets": { "const": false },
        "approvedDependencyBuilds": {
          "type": "array",
          "maxItems": 16,
          "uniqueItems": true,
          "items": { "type": "string", "pattern": "^(?:@[a-z0-9][a-z0-9._-]*/)?[a-z0-9][a-z0-9._-]*$", "maxLength": 214 }
        },
        "requiredDependencyBuilds": {
          "type": "array",
          "maxItems": 16,
          "uniqueItems": true,
          "items": { "type": "string", "pattern": "^(?:@[a-z0-9][a-z0-9._-]*/)?[a-z0-9][a-z0-9._-]*$", "maxLength": 214 }
        },
        "note": { "type": "string", "maxLength": 4096 }
      }
    }
  },
  "$defs": {
    "peerUsage": {
      "enum": ["runtime-import-observed", "type-only-reference-observed", "no-literal-reference-observed", "scan-incomplete"]
    },
    "peerPlaneUsage": {
      "type": "object",
      "additionalProperties": false,
      "required": ["host", "webClient", "unattributed"],
      "properties": {
        "clientPlatform": { "type": "string", "pattern": "^[a-z][a-z0-9-]{0,31}$" },
        "host": { "$ref": "#/$defs/peerUsage" },
        "webClient": { "$ref": "#/$defs/peerUsage" },
        "unattributed": { "$ref": "#/$defs/peerUsage" }
      }
    },
    "clientContract": {
      "type": "object",
      "additionalProperties": false,
      "required": ["platform", "inject", "entryPoints"],
      "properties": {
        "platform": { "type": "string", "pattern": "^[a-z][a-z0-9-]{0,31}$" },
        "inject": {
          "type": "array", "maxItems": 64, "uniqueItems": true,
          "items": { "type": "string", "minLength": 1, "maxLength": 214, "pattern": "^[A-Za-z@_][A-Za-z0-9@._/:-]*$" }
        },
        "entryPoints": {
          "type": "array", "maxItems": 64, "uniqueItems": true,
          "items": { "type": "string", "minLength": 1, "maxLength": 1024,
            "pattern": "^(?!/)(?!.*(?:^|/)\\.{1,2}(?:/|$))(?!.*//)(?!.*/$)[^*\\\\\\u0000-\\u0020\\u007f]+$" }
        }
      }
    },
    "artifact": {
      "type": "object",
      "additionalProperties": false,
      "required": ["spec", "name", "version", "lifecycleScripts"],
      "properties": {
        "spec": { "type": "string", "minLength": 1, "maxLength": 512 },
        "name": { "type": "string", "minLength": 1, "maxLength": 214 },
        "version": { "type": "string", "minLength": 1, "maxLength": 256 },
        "sha256": { "type": "string", "pattern": "^[0-9a-f]{64}$" },
        "integrity": { "type": "string", "maxLength": 1024 },
        "bytes": { "type": "integer", "minimum": 0, "maximum": 67108864 },
        "bundlePatch": { "type": "string", "minLength": 1, "maxLength": 4096 },
        "nodeEngine": { "type": "string", "minLength": 1, "maxLength": 512 },
        "client": { "$ref": "#/$defs/clientContract" },
        "lifecycleScripts": {
          "type": "array",
          "maxItems": 4,
          "uniqueItems": true,
          "items": { "enum": ["preinstall", "install", "postinstall", "prepare"] }
        }
      }
    },
    "resolution": {
      "type": "object",
      "additionalProperties": false,
      "properties": {
        "profileLockfile": {
          "type": "object",
          "additionalProperties": false,
          "required": ["sha256", "bytes"],
          "properties": {
            "sha256": { "type": "string", "pattern": "^[a-f0-9]{64}$" },
            "bytes": { "type": "integer", "minimum": 0, "maximum": 16777216 },
            "graphDigest": { "type": "string", "pattern": "^sha256:[a-f0-9]{64}$" },
            "nodes": { "type": "integer", "minimum": 0, "maximum": 100000 },
            "edges": { "type": "integer", "minimum": 0, "maximum": 250000 },
            "unresolved": { "type": "integer", "minimum": 0, "maximum": 250000 },
            "unresolvedDependencies": {
              "type": "array",
              "maxItems": 32,
              "items": {
                "type": "object",
                "additionalProperties": false,
                "required": ["from", "name", "spec", "kind"],
                "properties": {
                  "from": { "type": "string", "minLength": 1, "maxLength": 512 },
                  "name": { "type": "string", "minLength": 1, "maxLength": 214 },
                  "spec": { "type": "string", "minLength": 1, "maxLength": 512 },
                  "kind": { "enum": ["runtime", "development", "optional", "peer", "host-runtime"] }
                }
              }
            }
          }
        },
        "runtimeGraph": {
          "type": "object",
          "additionalProperties": false,
          "required": ["digest", "nodes", "edges", "unresolved", "pluginPeerContracts"],
          "properties": {
            "digest": { "type": "string", "pattern": "^sha256:[a-f0-9]{64}$" },
            "nodes": { "type": "integer", "minimum": 0, "maximum": 100000 },
            "edges": { "type": "integer", "minimum": 0, "maximum": 250000 },
            "unresolved": { "type": "integer", "minimum": 0, "maximum": 250000 },
            "unresolvedDependencies": {
              "type": "array",
              "maxItems": 32,
              "items": {
                "type": "object",
                "additionalProperties": false,
                "required": ["from", "name", "spec", "kind"],
                "properties": {
                  "from": { "type": "string", "minLength": 1, "maxLength": 512 },
                  "name": { "type": "string", "minLength": 1, "maxLength": 214 },
                  "spec": { "type": "string", "minLength": 1, "maxLength": 512 },
                  "kind": { "enum": ["runtime", "development", "optional", "peer", "host-runtime"] }
                }
              }
            },
            "optionalUnavailable": { "type": "integer", "minimum": 0, "maximum": 250000 },
            "optionalUnavailableDependencies": {
              "type": "array",
              "maxItems": 32,
              "items": {
                "type": "object",
                "additionalProperties": false,
                "required": ["from", "name", "spec", "kind"],
                "properties": {
                  "from": { "type": "string", "minLength": 1, "maxLength": 512 },
                  "name": { "type": "string", "minLength": 1, "maxLength": 214 },
                  "spec": { "type": "string", "minLength": 1, "maxLength": 512 },
                  "kind": { "enum": ["runtime", "development", "optional", "peer", "host-runtime"] }
                }
              }
            },
            "pluginPeerContracts": {
              "type": "object",
              "additionalProperties": false,
              "required": ["declared", "satisfied", "mismatched", "indeterminate", "missing", "relations"],
              "properties": {
                "declared": { "type": "integer", "minimum": 0, "maximum": 100000 },
                "satisfied": { "type": "integer", "minimum": 0, "maximum": 100000 },
                "mismatched": { "type": "integer", "minimum": 0, "maximum": 100000 },
                "indeterminate": { "type": "integer", "minimum": 0, "maximum": 100000 },
                "missing": { "type": "integer", "minimum": 0, "maximum": 100000 },
                "relations": {
                  "type": "array",
                  "maxItems": 64,
                  "items": {
                    "type": "object",
                    "additionalProperties": false,
                    "required": ["name", "required", "status", "staticUsage"],
                    "properties": {
                      "name": { "type": "string", "minLength": 1, "maxLength": 214 },
                      "required": { "type": "string", "minLength": 1, "maxLength": 512 },
                      "status": { "enum": ["satisfied", "mismatched", "indeterminate", "missing"] },
                      "staticUsage": { "enum": ["runtime-import-observed", "type-only-reference-observed", "no-literal-reference-observed", "scan-incomplete"] },
                      "usageByPlane": { "$ref": "#/$defs/peerPlaneUsage" },
                      "declaredClientInject": { "type": "boolean" },
                      "resolvedVersion": { "type": "string", "minLength": 1, "maxLength": 256 }
                    }
                  }
                },
                "issues": {
                  "type": "array",
                  "maxItems": 32,
                  "items": {
                    "type": "object",
                    "additionalProperties": false,
                    "required": ["name", "required", "status", "staticUsage"],
                    "properties": {
                      "name": { "type": "string", "minLength": 1, "maxLength": 214 },
                      "required": { "type": "string", "minLength": 1, "maxLength": 512 },
                      "status": { "enum": ["mismatched", "indeterminate", "missing"] },
                      "staticUsage": { "enum": ["runtime-import-observed", "type-only-reference-observed", "no-literal-reference-observed", "scan-incomplete"] },
                      "usageByPlane": { "$ref": "#/$defs/peerPlaneUsage" },
                      "declaredClientInject": { "type": "boolean" },
                      "resolvedVersion": { "type": "string", "minLength": 1, "maxLength": 256 }
                    }
                  }
                }
              }
            },
            "hostRuntime": {
              "type": "object",
              "additionalProperties": false,
              "required": ["source", "resolvedNodes"],
              "properties": {
                "source": { "enum": ["dsh-profile-fallback", "dsh-process"] },
                "resolvedNodes": { "type": "integer", "minimum": 0, "maximum": 100000 },
                "dshVersion": { "type": "string", "pattern": "^[0-9]+\\.[0-9]+\\.[0-9]+(?:-[0-9A-Za-z.-]+)?$" }
              }
            }
          }
        },
        "runtimeGraphError": { "type": "string", "minLength": 1, "maxLength": 512 }
      }
    },
    "stage": {
      "type": "object",
      "additionalProperties": false,
      "required": ["status"],
      "properties": {
        "status": { "enum": ["passed", "failed", "skipped"] },
        "code": { "type": ["integer", "null"] },
        "detail": { "type": "string", "maxLength": 8192 },
        "timedOut": { "type": "boolean" },
        "outputExceeded": { "type": "boolean" }
      }
    },
    "coverage": {
      "type": "object",
      "additionalProperties": false,
      "required": ["status", "tracer", "traceFiles", "bytes", "lines", "parsedEvents", "otherLines", "tamperResistance"],
      "properties": {
        "status": { "enum": ["captured", "missing", "truncated"] },
        "tracer": { "const": "strace" },
        "traceFiles": { "type": "integer", "minimum": 0 },
        "bytes": { "type": "integer", "minimum": 0, "maximum": 16777216 },
        "lines": { "type": "integer", "minimum": 0, "maximum": 100000 },
        "parsedEvents": { "type": "integer", "minimum": 0 },
        "otherLines": { "type": "integer", "minimum": 0 },
        "tamperResistance": { "const": "best-effort-same-container" }
      }
    },
    "process": {
      "type": "object",
      "additionalProperties": false,
      "required": ["executable", "arguments", "succeeded", "count"],
      "properties": {
        "executable": { "type": "string", "maxLength": 1024 },
        "arguments": { "type": "array", "maxItems": 16, "items": { "type": "string", "maxLength": 512 } },
        "succeeded": { "type": "boolean" },
        "count": { "type": "integer", "minimum": 1 }
      }
    },
    "network": {
      "type": "object",
      "additionalProperties": false,
      "required": ["operation", "family", "address", "succeeded", "count"],
      "properties": {
        "operation": { "enum": ["connect", "sendto", "sendmsg"] },
        "family": { "type": "string", "maxLength": 64 },
        "address": { "type": "string", "maxLength": 1024 },
        "port": { "type": "integer", "minimum": 0, "maximum": 65535 },
        "succeeded": { "type": "boolean" },
        "count": { "type": "integer", "minimum": 1 }
      }
    },
    "fileWrite": {
      "type": "object",
      "additionalProperties": false,
      "required": ["operation", "path", "succeeded", "count"],
      "properties": {
        "operation": { "type": "string", "maxLength": 64 },
        "path": { "type": "string", "maxLength": 1024 },
        "sourcePath": { "type": "string", "maxLength": 1024 },
        "succeeded": { "type": "boolean" },
        "count": { "type": "integer", "minimum": 1 }
      }
    },
    "trace": {
      "type": "object",
      "additionalProperties": false,
      "required": ["coverage", "processes", "network", "fileWrites"],
      "properties": {
        "coverage": { "$ref": "#/$defs/coverage" },
        "processes": { "type": "array", "maxItems": 512, "items": { "$ref": "#/$defs/process" } },
        "network": { "type": "array", "maxItems": 512, "items": { "$ref": "#/$defs/network" } },
        "fileWrites": { "type": "array", "maxItems": 512, "items": { "$ref": "#/$defs/fileWrite" } }
      }
    },
    "filesystemDiff": {
      "type": "object",
      "additionalProperties": false,
      "required": ["created", "modified", "deleted", "totals", "truncated", "snapshotErrors"],
      "properties": {
        "created": { "type": "array", "maxItems": 512, "items": { "type": "string", "maxLength": 4096 } },
        "modified": { "type": "array", "maxItems": 512, "items": { "type": "string", "maxLength": 4096 } },
        "deleted": { "type": "array", "maxItems": 512, "items": { "type": "string", "maxLength": 4096 } },
        "totals": {
          "type": "object",
          "additionalProperties": false,
          "required": ["created", "modified", "deleted"],
          "properties": {
            "created": { "type": "integer", "minimum": 0 },
            "modified": { "type": "integer", "minimum": 0 },
            "deleted": { "type": "integer", "minimum": 0 }
          }
        },
        "truncated": { "type": "boolean" },
        "snapshotErrors": { "type": "integer", "minimum": 0 }
      }
    }
  }
}
