{
  "schema": "upstream-radar.dsh-install-observation/v1alpha1",
  "tool": {
    "name": "upstream-radar",
    "version": "0.45.0"
  },
  "probe": "dsh-install",
  "scope": "install-and-load-behavior",
  "startedAt": "2026-09-13T11:16:38.390Z",
  "completedAt": "2026-09-13T11:18:40.937Z",
  "caseId": "cloudflare-browser-node22",
  "dshVersion": "0.1.5-rc.2",
  "runtime": {
    "platform": "linux",
    "architecture": "arm64",
    "nodeVersion": "22.23.2",
    "packageManager": {
      "name": "pnpm",
      "version": "11.7.0"
    }
  },
  "artifact": {
    "spec": "npm:dsh-cloudflare-browser-run@0.1.9",
    "name": "dsh-cloudflare-browser-run",
    "version": "0.1.9",
    "lifecycleScripts": [],
    "sha256": "887ea8a5170bd39f841adef7678961ea31f7676ea9c50cee7fd5b412ba8fe77a",
    "bytes": 8499,
    "bundlePatch": "cordis.patch.yml",
    "nodeEngine": ">=20.0.0"
  },
  "stages": {
    "runtime": {
      "status": "passed",
      "code": 0
    },
    "artifact": {
      "status": "passed",
      "code": 0
    },
    "profile": {
      "status": "failed",
      "code": null,
      "detail": "command timed out: Progress: resolved 1, reused 0, downloaded 0, added 0\\u000aProgress: resolved 4, reused 0, downloaded 0, added 0\\u000aProgress: resolved 40, reused 0, downloaded 22, added 0\\u000aProgress: resolved 59, reused 0, downloaded 53, added 0\\u000aProgress: resolved 66, reused 0, downloaded 65, added 0\\u000aProgress: resolved 67, reused 0, downloaded 66, added 0\\u000aProgress: resolved 68, reused 0, downloaded 66, added 0\\u000a[WARN] Tarball download average speed 45 KiB/s (size 126 KiB) is below 50 KiB/s: https://registry.npmjs.org/@deepseek-ai/dsh-tool-cordis/-/dsh-tool-cordis-0.1.5-rc.2.tgz (GET)\\u000aProgress: resolved 68, reused 0, downloaded 68, added 0\\u000a[WARN] Request took 12796ms: https://registry.npmjs.org/@deepseek-ai%2Fcordis-plugin-timer\\u000aProgress: resolved 69, reused 0, downloaded 68, added 0\\u000aProgress: resolved 69, reused 0, downloaded 69, added 0\\u000a[WARN] GET https://registry.npmjs.org/@deepseek-ai%2Fdsh-launch-environment error (ECONNRESET). Will retry in 10 seconds. 2 retries left.\\u000a[WARN] Request took 54555ms: https://registry.npmjs.org/@deepseek-ai%2Fdsh-launch-environment\\u000aProgress: resolved 70, reused 0, downloaded 69, added 0\\u000aProgress: resolved 70, reused 0, downloaded 70, added 0\\u000a[WARN] GET https://registry.npmjs.org/@deepseek-ai%2Fdsh-app-boot error (23). Will retry in 10 seconds. 2 retries left.\\u000a[WARN] GET https://registry.npmjs.org/@deepseek-ai%2Fdsh-command-compact error (23). Will retry in 10 seconds. 2 retries left.\\u000a[WARN] GET https://registry.npmjs.org/@deepseek-ai%2Fdsh-tool-bash error (23). Will retry in 10 seconds. 2 retries left.\\u000aProgress: resolved 71, reused 0, downloaded 70, added 0\\u000a[WARN] Request took 70925ms: https://registry.npmjs.org/@deepseek-ai%2Fdsh-tool-bash\\u000a[WARN] Request took 70950ms: https://registry.npmjs.org/@deepseek-ai%2Fdsh-command-compact\\u000aProgress: resolved 76, reused 0, downloaded 72, added 0\\u000aProgress: resolved 99, reused 0, downloaded 77, added 0\\u000aProgress: resolved 121, reused 0, downloaded 103, added 0\\u000aProgress: resolved 138, reused 0, downloaded 122, added 0\\u000aProgress: resolved 170, reused 0, downloaded 144, added 0\\u000aProgress: resolved 220, reused 0, downloaded 201, added 0\\u000aProgress: resolved 223, reused 0, downloaded 213, added 0\\u000aProgress: resolved 223, reused 0, downloaded 216, added 0\\u000aProgress: resolved 223, reused 0, downloaded 217, added 0\\u000a[WARN] GET https://registry.npmjs.org/@deepseek-ai%2Fdsh-storage-domain error (ECONNRESET). Will retry in 10 seconds. 2 retries left.\\u000a[WARN] Request took 47153ms: https://registry.npmjs.org/@deepseek-ai%2Fdsh-storage-domain\\u000aProgress: resolved 224, reused 0, downloaded 217, added 0",
      "timedOut": true
    },
    "install": {
      "status": "skipped"
    },
    "registration": {
      "status": "skipped"
    },
    "load": {
      "status": "skipped"
    }
  },
  "observations": {
    "install": {
      "coverage": {
        "status": "missing",
        "tracer": "strace",
        "traceFiles": 0,
        "bytes": 0,
        "lines": 0,
        "parsedEvents": 0,
        "otherLines": 0,
        "tamperResistance": "best-effort-same-container"
      },
      "processes": [],
      "network": [],
      "fileWrites": []
    },
    "load": {
      "coverage": {
        "status": "missing",
        "tracer": "strace",
        "traceFiles": 0,
        "bytes": 0,
        "lines": 0,
        "parsedEvents": 0,
        "otherLines": 0,
        "tamperResistance": "best-effort-same-container"
      },
      "processes": [],
      "network": [],
      "fileWrites": []
    }
  },
  "filesystem": {
    "install": {
      "created": [],
      "modified": [],
      "deleted": [],
      "totals": {
        "created": 0,
        "modified": 0,
        "deleted": 0
      },
      "truncated": false,
      "snapshotErrors": 0
    },
    "load": {
      "created": [],
      "modified": [],
      "deleted": [],
      "totals": {
        "created": 0,
        "modified": 0,
        "deleted": 0
      },
      "truncated": false,
      "snapshotErrors": 0
    }
  },
  "resolution": {},
  "result": "unknown",
  "reason": "the exact DSH runtime could not initialize the disposable profile",
  "boundary": {
    "isolationProviderClaim": "other",
    "isolationVerifiedByRadar": false,
    "disposableEnvironmentRequired": true,
    "lifecycleScriptsEnabledForPluginInstall": true,
    "pluginCodeMayExecuteDuringLoad": true,
    "inheritedHostSecrets": false,
    "approvedDependencyBuilds": [],
    "requiredDependencyBuilds": [],
    "note": "Radar scrubs the child environment and records Linux system-call evidence, but the caller provides and must verify the disposable isolation boundary. Same-container traces are best-effort evidence, not a malicious-code safety certificate."
  }
}
