{
  "schema": "upstream-radar.dsh-install-observation/v1alpha1",
  "tool": {
    "name": "upstream-radar",
    "version": "0.45.0"
  },
  "probe": "dsh-install",
  "scope": "install-and-load-behavior",
  "startedAt": "2026-09-13T11:16:38.391Z",
  "completedAt": "2026-09-13T11:18:44.142Z",
  "caseId": "better-sidebar-node22",
  "dshVersion": "0.1.5-rc.2",
  "runtime": {
    "platform": "linux",
    "architecture": "arm64",
    "nodeVersion": "22.23.2",
    "packageManager": {
      "name": "pnpm",
      "version": "11.7.0"
    }
  },
  "artifact": {
    "spec": "npm:dsh-better-sidebar@0.19.1",
    "name": "dsh-better-sidebar",
    "version": "0.19.1",
    "lifecycleScripts": [],
    "sha256": "67969b94e96747ad910ce945bafa2b8176af584fb8bc02f87dce5ed132986884",
    "bytes": 3484248,
    "bundlePatch": "cordis.patch.yml",
    "nodeEngine": ">=20"
  },
  "stages": {
    "runtime": {
      "status": "passed",
      "code": 0
    },
    "artifact": {
      "status": "passed",
      "code": 0
    },
    "profile": {
      "status": "failed",
      "code": null,
      "detail": "command timed out: Progress: resolved 1, reused 0, downloaded 0, added 0\\u000aProgress: resolved 8, reused 0, downloaded 0, added 0\\u000aProgress: resolved 32, reused 0, downloaded 17, added 0\\u000aProgress: resolved 45, reused 0, downloaded 45, added 0\\u000aProgress: resolved 50, reused 0, downloaded 48, added 0\\u000aProgress: resolved 60, reused 0, downloaded 58, added 0\\u000aProgress: resolved 68, reused 0, downloaded 66, added 0\\u000aProgress: resolved 68, reused 0, downloaded 68, added 0\\u000a[WARN] GET https://registry.npmjs.org/js-yaml error (23). Will retry in 10 seconds. 2 retries left.\\u000a[WARN] GET https://registry.npmjs.org/@deepseek-ai%2Fdsh-launch-environment error (23). Will retry in 10 seconds. 2 retries left.\\u000a[WARN] GET https://registry.npmjs.org/@deepseek-ai%2Fdsh-session-reference error (23). Will retry in 10 seconds. 2 retries left.\\u000a[WARN] GET https://registry.npmjs.org/@deepseek-ai%2Fdsh-sdk-minimal error (23). Will retry in 10 seconds. 2 retries left.\\u000a[WARN] GET https://registry.npmjs.org/@deepseek-ai%2Fdsh-tool-bash error (23). Will retry in 10 seconds. 2 retries left.\\u000a[WARN] Request took 70978ms: https://registry.npmjs.org/@deepseek-ai%2Fdsh-tool-bash\\u000aProgress: resolved 69, reused 0, downloaded 68, added 0\\u000a[WARN] Request took 71681ms: https://registry.npmjs.org/js-yaml\\u000a[WARN] Request took 71673ms: https://registry.npmjs.org/@deepseek-ai%2Fdsh-launch-environment\\u000a[WARN] Request took 71972ms: https://registry.npmjs.org/@deepseek-ai%2Fdsh-session-reference\\u000aProgress: resolved 72, reused 0, downloaded 71, added 0\\u000aProgress: resolved 83, reused 0, downloaded 72, added 0\\u000aProgress: resolved 102, reused 0, downloaded 81, added 0\\u000aProgress: resolved 112, reused 0, downloaded 98, added 0\\u000aProgress: resolved 117, reused 0, downloaded 106, added 0\\u000aProgress: resolved 131, reused 0, downloaded 115, added 0\\u000aProgress: resolved 144, reused 0, downloaded 129, added 0\\u000aProgress: resolved 177, reused 0, downloaded 150, added 0\\u000aProgress: resolved 219, reused 0, downloaded 195, added 0\\u000aProgress: resolved 226, reused 0, downloaded 209, added 0\\u000aProgress: resolved 226, reused 0, downloaded 213, added 0\\u000aProgress: resolved 226, reused 0, downloaded 215, added 0\\u000a[WARN] Tarball download average speed 22 KiB/s (size 44 KiB) is below 50 KiB/s: https://registry.npmjs.org/@deepseek-ai/dsh-host-open-in-app/-/dsh-host-open-in-app-0.1.5-rc.2.tgz (GET)\\u000aProgress: resolved 226, reused 0, downloaded 217, added 0\\u000aProgress: resolved 226, reused 0, downloaded 218, added 0\\u000a[WARN] Tarball download average speed 12 KiB/s (size 80 KiB) is below 50 KiB/s: https://registry.npmjs.org/@deepseek-ai/dsh-session/-/dsh-session-0.1.5-rc.2.tgz (GET)\\u000aProgress: resolved 226, reused 0, downloaded 219, added 0\\u000a[WARN] Request took 38497ms: https://registry.npmjs.org/@deepseek-ai%2Fdsh-session-title\\u000aProgress: resolved 227, reused 0, downloaded 219, added 0\\u000aProgress: resolved 227, reused 0, downloaded 220, added 0",
      "timedOut": true
    },
    "install": {
      "status": "skipped"
    },
    "registration": {
      "status": "skipped"
    },
    "load": {
      "status": "skipped"
    }
  },
  "observations": {
    "install": {
      "coverage": {
        "status": "missing",
        "tracer": "strace",
        "traceFiles": 0,
        "bytes": 0,
        "lines": 0,
        "parsedEvents": 0,
        "otherLines": 0,
        "tamperResistance": "best-effort-same-container"
      },
      "processes": [],
      "network": [],
      "fileWrites": []
    },
    "load": {
      "coverage": {
        "status": "missing",
        "tracer": "strace",
        "traceFiles": 0,
        "bytes": 0,
        "lines": 0,
        "parsedEvents": 0,
        "otherLines": 0,
        "tamperResistance": "best-effort-same-container"
      },
      "processes": [],
      "network": [],
      "fileWrites": []
    }
  },
  "filesystem": {
    "install": {
      "created": [],
      "modified": [],
      "deleted": [],
      "totals": {
        "created": 0,
        "modified": 0,
        "deleted": 0
      },
      "truncated": false,
      "snapshotErrors": 0
    },
    "load": {
      "created": [],
      "modified": [],
      "deleted": [],
      "totals": {
        "created": 0,
        "modified": 0,
        "deleted": 0
      },
      "truncated": false,
      "snapshotErrors": 0
    }
  },
  "resolution": {},
  "result": "unknown",
  "reason": "the exact DSH runtime could not initialize the disposable profile",
  "boundary": {
    "isolationProviderClaim": "other",
    "isolationVerifiedByRadar": false,
    "disposableEnvironmentRequired": true,
    "lifecycleScriptsEnabledForPluginInstall": true,
    "pluginCodeMayExecuteDuringLoad": true,
    "inheritedHostSecrets": false,
    "approvedDependencyBuilds": [],
    "requiredDependencyBuilds": [],
    "note": "Radar scrubs the child environment and records Linux system-call evidence, but the caller provides and must verify the disposable isolation boundary. Same-container traces are best-effort evidence, not a malicious-code safety certificate."
  }
}
