{
  "schema": "upstream-radar.dsh-install-observation/v1alpha1",
  "tool": {
    "name": "upstream-radar",
    "version": "0.45.0"
  },
  "probe": "dsh-install",
  "scope": "install-and-load-behavior",
  "startedAt": "2026-09-13T11:20:44.022Z",
  "completedAt": "2026-09-13T11:22:44.280Z",
  "caseId": "dsh-univer-office-node22",
  "dshVersion": "0.1.5-rc.2",
  "runtime": {
    "platform": "linux",
    "architecture": "arm64",
    "nodeVersion": "22.23.2",
    "packageManager": {
      "name": "pnpm",
      "version": "11.7.0"
    }
  },
  "artifact": {
    "spec": "npm:dsh-univer-office@0.2.14",
    "name": "dsh-univer-office",
    "version": "0.2.14",
    "lifecycleScripts": []
  },
  "stages": {
    "runtime": {
      "status": "passed",
      "code": 0
    },
    "artifact": {
      "status": "failed",
      "code": null,
      "detail": "command timed out",
      "timedOut": true
    },
    "profile": {
      "status": "skipped"
    },
    "install": {
      "status": "skipped"
    },
    "registration": {
      "status": "skipped"
    },
    "load": {
      "status": "skipped"
    }
  },
  "observations": {
    "install": {
      "coverage": {
        "status": "missing",
        "tracer": "strace",
        "traceFiles": 0,
        "bytes": 0,
        "lines": 0,
        "parsedEvents": 0,
        "otherLines": 0,
        "tamperResistance": "best-effort-same-container"
      },
      "processes": [],
      "network": [],
      "fileWrites": []
    },
    "load": {
      "coverage": {
        "status": "missing",
        "tracer": "strace",
        "traceFiles": 0,
        "bytes": 0,
        "lines": 0,
        "parsedEvents": 0,
        "otherLines": 0,
        "tamperResistance": "best-effort-same-container"
      },
      "processes": [],
      "network": [],
      "fileWrites": []
    }
  },
  "filesystem": {
    "install": {
      "created": [],
      "modified": [],
      "deleted": [],
      "totals": {
        "created": 0,
        "modified": 0,
        "deleted": 0
      },
      "truncated": false,
      "snapshotErrors": 0
    },
    "load": {
      "created": [],
      "modified": [],
      "deleted": [],
      "totals": {
        "created": 0,
        "modified": 0,
        "deleted": 0
      },
      "truncated": false,
      "snapshotErrors": 0
    }
  },
  "resolution": {},
  "result": "unknown",
  "reason": "the exact npm artifact could not be established before execution",
  "boundary": {
    "isolationProviderClaim": "other",
    "isolationVerifiedByRadar": false,
    "disposableEnvironmentRequired": true,
    "lifecycleScriptsEnabledForPluginInstall": true,
    "pluginCodeMayExecuteDuringLoad": true,
    "inheritedHostSecrets": false,
    "approvedDependencyBuilds": [],
    "requiredDependencyBuilds": [],
    "note": "Radar scrubs the child environment and records Linux system-call evidence, but the caller provides and must verify the disposable isolation boundary. Same-container traces are best-effort evidence, not a malicious-code safety certificate."
  }
}
